{
  "kind": "cineweave_codex_control_benchmark",
  "contractVersion": "1.1.0",
  "suiteId": "benchmark.cineweave-controlbench",
  "title": "CineWeave ControlBench",
  "version": 1,
  "status": "active",
  "skillReceipt": {
    "repository": "https://github.com/owner/repository",
    "ref": "v1.1.0",
    "commit": "0123456789abcdef0123456789abcdef01234567",
    "contentHash": "sha256:aaaaaaaaaaaaaaaaaaaaaaaaaaaaaaaaaaaaaaaaaaaaaaaaaaaaaaaaaaaaaaaa",
    "installedBy": "codex-environment",
    "usedAt": "2026-08-20T18:00:00.000Z"
  },
  "purpose": "验证人物、造型、场景、交互、分镜、电影语言和权利控制在不同适配器上的可执行性与修复闭环。",
  "scopes": [
    "CharacterBench",
    "AppearanceBench",
    "SceneBench",
    "InteractionBench",
    "StoryboardBench",
    "RightsBench"
  ],
  "dimensions": [
    {
      "dimensionId": "dimension.identity",
      "scope": "character",
      "description": "跨视角、表情和镜头的人物身份一致性。",
      "severity": "blocking",
      "metricIds": [
        "metric.identity",
        "metric.anchor-rule",
        "metric.human-identity"
      ]
    },
    {
      "dimensionId": "dimension.appearance",
      "scope": "appearance",
      "description": "妆容、发型、服装结构、材质与搭配一致性。",
      "severity": "important",
      "metricIds": [
        "metric.appearance-rule",
        "metric.human-styling"
      ]
    },
    {
      "dimensionId": "dimension.scene",
      "scope": "scene",
      "description": "场景地理、时间、光照和材质状态一致性。",
      "severity": "blocking",
      "metricIds": [
        "metric.layout",
        "metric.light-rule",
        "metric.human-scene"
      ]
    },
    {
      "dimensionId": "dimension.interaction",
      "scope": "interaction",
      "description": "人物与地面、道具、遮挡、光影和环境的真实互动。",
      "severity": "blocking",
      "metricIds": [
        "metric.contact-rule",
        "metric.pose",
        "metric.human-interaction"
      ]
    },
    {
      "dimensionId": "dimension.story",
      "scope": "storyboard",
      "description": "行为因果、情绪曲线、轴线、视线和道具状态连续性。",
      "severity": "blocking",
      "metricIds": [
        "metric.continuity-rule",
        "metric.human-story"
      ]
    },
    {
      "dimensionId": "dimension.rights",
      "scope": "rights",
      "description": "所有执行输入具有明确许可和肖像/资产权利。",
      "severity": "blocking",
      "metricIds": [
        "metric.rights-rule"
      ]
    }
  ],
  "metrics": [
    {
      "metricId": "metric.identity",
      "type": "embedding",
      "description": "同一角色候选之间的身份相似度。",
      "direction": "higher_is_better",
      "passThreshold": 0.82,
      "range": "0..1"
    },
    {
      "metricId": "metric.anchor-rule",
      "type": "rule",
      "description": "关键面部和身体锚点是否可见且未漂移。",
      "direction": "boolean",
      "passThreshold": true
    },
    {
      "metricId": "metric.human-identity",
      "type": "human",
      "description": "人工判断去服装和跨表情后是否仍为同一角色。",
      "direction": "higher_is_better",
      "passThreshold": 0.85,
      "range": "0..1"
    },
    {
      "metricId": "metric.appearance-rule",
      "type": "segmentation",
      "description": "服装组件、色块与饰品位置一致性。",
      "direction": "higher_is_better",
      "passThreshold": 0.78,
      "range": "0..1"
    },
    {
      "metricId": "metric.human-styling",
      "type": "human",
      "description": "妆发、材质、搭配和质感是否符合 AppearanceState。",
      "direction": "higher_is_better",
      "passThreshold": 0.8,
      "range": "0..1"
    },
    {
      "metricId": "metric.layout",
      "type": "layout",
      "description": "场景锚点和人物位置相对误差。",
      "direction": "lower_is_better",
      "passThreshold": 0.12,
      "range": "0..1 normalized error"
    },
    {
      "metricId": "metric.light-rule",
      "type": "rule",
      "description": "光源方向、接触阴影与人物背景曝光关系是否一致。",
      "direction": "boolean",
      "passThreshold": true
    },
    {
      "metricId": "metric.human-scene",
      "type": "human",
      "description": "人物是否真实融入背景。",
      "direction": "higher_is_better",
      "passThreshold": 0.8,
      "range": "0..1"
    },
    {
      "metricId": "metric.contact-rule",
      "type": "rule",
      "description": "必须接触点、遮挡顺序和道具状态是否满足。",
      "direction": "boolean",
      "passThreshold": true
    },
    {
      "metricId": "metric.pose",
      "type": "pose",
      "description": "身体姿态和重心与绑定的匹配度。",
      "direction": "higher_is_better",
      "passThreshold": 0.78,
      "range": "0..1"
    },
    {
      "metricId": "metric.human-interaction",
      "type": "human",
      "description": "接触、承重、抓握和环境响应是否可信。",
      "direction": "higher_is_better",
      "passThreshold": 0.78,
      "range": "0..1"
    },
    {
      "metricId": "metric.continuity-rule",
      "type": "temporal",
      "description": "人物、场景、轴线、道具和情绪状态跨镜头连续。",
      "direction": "boolean",
      "passThreshold": true
    },
    {
      "metricId": "metric.human-story",
      "type": "human",
      "description": "行为因果和情绪变化是否合理。",
      "direction": "higher_is_better",
      "passThreshold": 0.82,
      "range": "0..1"
    },
    {
      "metricId": "metric.rights-rule",
      "type": "rule",
      "description": "Capability、Evidence 和执行输入的 LicenseProfile 全部已解析。",
      "direction": "boolean",
      "passThreshold": true
    }
  ],
  "cases": [
    {
      "caseId": "case.expression-sheet",
      "category": "expression",
      "recipeRef": {
        "id": "recipe.shen-expression-sheet-3x3",
        "version": 1,
        "contentHash": "sha256:eeeeeeeeeeeeeeeeeeeeeeeeeeeeeeeeeeeeeeeeeeeeeeeeeeeeeeeeeeeeeeee"
      },
      "controlSetRef": {
        "id": "controls.shen-expression-sheet",
        "version": 1,
        "contentHash": "sha256:8888888888888888888888888888888888888888888888888888888888888888"
      },
      "evidenceBundleRef": {
        "id": "evidence.shen-production",
        "version": 1,
        "contentHash": "sha256:9999999999999999999999999999999999999999999999999999999999999999"
      },
      "perturbation": "九个独立表情任务只改变 emotion state。",
      "expectedInvariants": [
        "身份、妆发、服装、机位、背景、光照"
      ],
      "expectedAllowedChanges": [
        "表情、情绪强度和隐藏程度"
      ],
      "failureLabels": [
        "identity_drift",
        "appearance_drift",
        "expression_collapse",
        "camera_drift"
      ],
      "repetitions": 3,
      "humanReviewRequired": true
    },
    {
      "caseId": "case.scene-interaction",
      "category": "interaction",
      "recipeRef": {
        "id": "recipe.storyboard-sequence-4up",
        "version": 1,
        "contentHash": "sha256:1111111111111111111111111111111111111111111111111111111111111111"
      },
      "controlSetRef": {
        "id": "controls.shen-expression-sheet",
        "version": 1,
        "contentHash": "sha256:8888888888888888888888888888888888888888888888888888888888888888"
      },
      "evidenceBundleRef": {
        "id": "evidence.shen-production",
        "version": 1,
        "contentHash": "sha256:9999999999999999999999999999999999999999999999999999999999999999"
      },
      "perturbation": "人物后撤并保护孩子，同时保持地面接触、遮挡和光影。",
      "expectedInvariants": [
        "走廊地理、人物身份、右手惯用侧、光源方向"
      ],
      "expectedAllowedChanges": [
        "动作状态和衣摆风响应"
      ],
      "failureLabels": [
        "floating_feet",
        "occlusion_error",
        "grip_error",
        "light_mismatch"
      ],
      "repetitions": 3,
      "humanReviewRequired": true
    },
    {
      "caseId": "case.rights-gate",
      "category": "rights",
      "recipeRef": {
        "id": "recipe.shen-expression-sheet-3x3",
        "version": 1,
        "contentHash": "sha256:eeeeeeeeeeeeeeeeeeeeeeeeeeeeeeeeeeeeeeeeeeeeeeeeeeeeeeeeeeeeeeee"
      },
      "controlSetRef": {
        "id": "controls.shen-expression-sheet",
        "version": 1,
        "contentHash": "sha256:8888888888888888888888888888888888888888888888888888888888888888"
      },
      "evidenceBundleRef": {
        "id": "evidence.shen-production",
        "version": 1,
        "contentHash": "sha256:9999999999999999999999999999999999999999999999999999999999999999"
      },
      "perturbation": "将一个参考资产许可状态设置为 unknown。",
      "expectedInvariants": [
        "未知商用许可必须阻断最终执行"
      ],
      "expectedAllowedChanges": [
        "仅允许补充或更换许可证据"
      ],
      "failureLabels": [
        "rights_gate_bypass"
      ],
      "repetitions": 1,
      "humanReviewRequired": true
    }
  ],
  "humanReview": {
    "requiredForBlockingDimensions": true,
    "rubric": [
      "人物是否仍可无服装识别",
      "造型是否符合结构和材质设定",
      "人物是否真实接触场景与道具",
      "行为与情绪是否有前因后果",
      "所有权利是否明确"
    ],
    "reviewerCount": 1
  },
  "acceptance": {
    "minimumCasePassRate": 0.85,
    "blockingDimensionPassRate": 1,
    "allRightsCasesPass": true
  },
  "executionBoundary": {
    "providerNeutral": true,
    "generatesMedia": false,
    "humanApprovalRequired": true
  },
  "validation": {
    "metricRefsResolved": true,
    "recipeRefsResolved": true,
    "controlRefsResolved": true,
    "evidenceRefsResolved": true,
    "rightsCasesIncluded": true
  },
  "provenance": {
    "source": "codex_authored",
    "createdAt": "2026-08-20T18:00:00.000Z",
    "updatedAt": "2026-08-20T18:00:00.000Z",
    "changeLog": [
      "v1: establish Character, Scene, Interaction, Storyboard and Rights benchmarks"
    ]
  }
}
